hash-threshold 100

statement ok
INSERT INTO T1(xt$id, col1, col2) VALUES(1,'fish',1000)

statement ok
INSERT INTO t1(xt$id, coL1, COL2) VALUES(2,'dog',2000)

query ITI rowsort
SELECT t1.XT$ID, T1.col1, t1.cOl2 FROM T1
----
1
fish
1000
2
dog
2000

query ITI rowsort
SELECT "t1".xt$id, T1."col1", t1.cOl2 FROM "t1"
----
1
fish
1000
2
dog
2000

query ITI rowsort
SELECT "T1".xt$id, "T1".col1, "T1".cOl2 FROM "T1"
----
1
fish
1000
2
dog
2000

statement ok
INSERT INTO "T1"(xt$id, "COl1", "col2") VALUES(3,'cat',3000)

query ITI rowsort
SELECT "T1".xt$id, "T1"."COl1", "T1".cOl2 FROM "T1"
----
1
fish
1000
2
dog
2000
3
cat
3000

statement ok
UPDATE T1 SET cOl1 = 30 WHERE t1.col2 IN (313, 2000)

query ITI rowsort
SELECT t1.xt$id, T1.col1, "t1".col2 FROM t1
----
1
fish
1000
2
30
2000
3
cat
3000

query TI
SELECT T1.col1, AVG(t1.col2) FROM t1 GROUP BY T1.col1
----
30
2000
fish
1000
cat
3000

query T
SELECT t1.col1 FROM T1 WHERE t1.col1 IN ( T1.COL1 )
----
30
fish
cat

query I
SELECT teeone.col2 FROM t1 AS TEEoNE WHERE TEEone.col1 = ( SELECT t1.col1 FROM T1 WHERE t1.col1 = teeONe.cOL1 ) ORDER BY teeone."CoL2"
----
1000
2000
3000

query I
SELECT "TeeoNE".col2 FROM "T1" AS "TeeoNE" WHERE "TeeoNE"."COl1" IN ( SELECT "T1"."COl1" FROM "T1" WHERE "T1"."COl1" = "TeeoNE"."COl1" ) ORDER BY "TeeoNE".col2
----
1000
2000
3000

statement ok
DELETE FROM T1 WHERE t1.cOl1 = 'fish'

query ITI rowsort
SELECT t1.XT$ID FROM T1
----
2
3

statement ok
DELETE FROM "T1" WHERE "T1"."cOL2" IN (2000, 3000)

query I rowsort
SELECT "T1".xt$id FROM "T1"
----
