hash-threshold 100

statement ok
INSERT INTO Prop_Owner (_id, customer_number, property_number, _valid_from)
VALUES (1, 145, 7797, TIMESTAMP '1998-01-10Z')

query IIITTTT nosort
SELECT *
  FROM Prop_Owner AS x (_id,
                        customer_number,
                        property_number,
                        _valid_from,
                        _valid_to,
                        _system_from,
                        _system_to)
----
1
145
7797
1998-01-10T00:00Z[UTC]
NULL
2020-01-01T00:00Z[UTC]
NULL

statement ok
INSERT INTO Prop_Owner (_id, customer_number, property_number, _valid_from)
VALUES (1, 827, 7797, TIMESTAMP '1998-01-15Z')

query IIITTTT nosort
SELECT *
  FROM Prop_Owner AS x (_id,
                        customer_number,
                        property_number,
                        _valid_from,
                        _valid_to,
                        _system_from,
                        _system_to)
----
1
827
7797
1998-01-15T00:00Z[UTC]
NULL
2020-01-02T00:00Z[UTC]
NULL

query IIITTTT rowsort
SELECT *
  FROM Prop_Owner
         FOR ALL SYSTEM_TIME
         FOR ALL VALID_TIME
         AS x (_id,
               customer_number,
               property_number,
               _valid_from,
               _valid_to,
               _system_from,
               _system_to)
----
1
145
7797
1998-01-10T00:00Z[UTC]
1998-01-15T00:00Z[UTC]
2020-01-01T00:00Z[UTC]
NULL
1
145
7797
1998-01-15T00:00Z[UTC]
NULL
2020-01-01T00:00Z[UTC]
2020-01-02T00:00Z[UTC]
1
827
7797
1998-01-15T00:00Z[UTC]
NULL
2020-01-02T00:00Z[UTC]
NULL

statement ok
DELETE
FROM Prop_Owner
     FOR PORTION OF VALID_TIME FROM TIMESTAMP '1998-01-20Z' TO NULL
WHERE Prop_Owner.property_number = 7797

query IIITTTT nosort
SELECT *
  FROM Prop_Owner
         AS x (_id,
               customer_number,
               property_number,
               _valid_from,
               _valid_to,
               _system_from,
               _system_to)
----


query IIITTTT rowsort
SELECT *
  FROM Prop_Owner
         FOR ALL SYSTEM_TIME
         FOR ALL VALID_TIME
         AS x (_id,
               customer_number,
               property_number,
               _valid_from,
               _valid_to,
               _system_from,
               _system_to)
----
1
145
7797
1998-01-10T00:00Z[UTC]
1998-01-15T00:00Z[UTC]
2020-01-01T00:00Z[UTC]
NULL
1
145
7797
1998-01-15T00:00Z[UTC]
NULL
2020-01-01T00:00Z[UTC]
2020-01-02T00:00Z[UTC]
1
827
7797
1998-01-15T00:00Z[UTC]
1998-01-20T00:00Z[UTC]
2020-01-02T00:00Z[UTC]
NULL
1
827
7797
1998-01-20T00:00Z[UTC]
NULL
2020-01-02T00:00Z[UTC]
2020-01-03T00:00Z[UTC]

statement ok
INSERT INTO Prop_Owner (_id, customer_number, property_number, _valid_from, _valid_to)
VALUES (1, 145, 7797, TIMESTAMP '1998-01-03Z', TIMESTAMP '1998-01-10Z')

query IIITTTT rowsort
SELECT *
  FROM Prop_Owner
         FOR ALL SYSTEM_TIME
         FOR ALL VALID_TIME
         AS x (_id,
               customer_number,
               property_number,
               _valid_from,
               _valid_to,
               _system_from,
               _system_to)
----
1
145
7797
1998-01-03T00:00Z[UTC]
1998-01-10T00:00Z[UTC]
2020-01-04T00:00Z[UTC]
NULL
1
145
7797
1998-01-10T00:00Z[UTC]
1998-01-15T00:00Z[UTC]
2020-01-01T00:00Z[UTC]
NULL
1
145
7797
1998-01-15T00:00Z[UTC]
NULL
2020-01-01T00:00Z[UTC]
2020-01-02T00:00Z[UTC]
1
827
7797
1998-01-15T00:00Z[UTC]
1998-01-20T00:00Z[UTC]
2020-01-02T00:00Z[UTC]
NULL
1
827
7797
1998-01-20T00:00Z[UTC]
NULL
2020-01-02T00:00Z[UTC]
2020-01-03T00:00Z[UTC]

statement ok
DELETE
FROM Prop_Owner
FOR PORTION OF VALID_TIME
FROM TIMESTAMP '1998-01-03Z' TO TIMESTAMP '1998-01-05Z'

query IIITTTT rowsort
SELECT *
  FROM Prop_Owner
         FOR ALL SYSTEM_TIME
         FOR ALL VALID_TIME
         AS x (_id,
               customer_number,
               property_number,
               _valid_from,
               _valid_to,
               _system_from,
               _system_to)
----
1
145
7797
1998-01-03T00:00Z[UTC]
1998-01-05T00:00Z[UTC]
2020-01-04T00:00Z[UTC]
2020-01-05T00:00Z[UTC]
1
145
7797
1998-01-05T00:00Z[UTC]
1998-01-10T00:00Z[UTC]
2020-01-04T00:00Z[UTC]
NULL
1
145
7797
1998-01-10T00:00Z[UTC]
1998-01-15T00:00Z[UTC]
2020-01-01T00:00Z[UTC]
NULL
1
145
7797
1998-01-15T00:00Z[UTC]
NULL
2020-01-01T00:00Z[UTC]
2020-01-02T00:00Z[UTC]
1
827
7797
1998-01-15T00:00Z[UTC]
1998-01-20T00:00Z[UTC]
2020-01-02T00:00Z[UTC]
NULL
1
827
7797
1998-01-20T00:00Z[UTC]
NULL
2020-01-02T00:00Z[UTC]
2020-01-03T00:00Z[UTC]

statement ok
INSERT INTO Prop_Owner (_id,
                        customer_number,
                        property_number,
                        _valid_from,
                        _valid_to)
VALUES (1, 145, 7797, TIMESTAMP '1998-01-05Z', TIMESTAMP '1998-01-12Z'),
       (1, 827, 7797, TIMESTAMP '1998-01-12Z', TIMESTAMP '1998-01-20Z')

query IIITTTT rowsort
SELECT *
  FROM Prop_Owner
         FOR ALL SYSTEM_TIME
         FOR ALL VALID_TIME
         AS x (_id,
               customer_number,
               property_number,
               _valid_from,
               _valid_to,
               _system_from,
               _system_to)
----
1
145
7797
1998-01-03T00:00Z[UTC]
1998-01-05T00:00Z[UTC]
2020-01-04T00:00Z[UTC]
2020-01-05T00:00Z[UTC]
1
145
7797
1998-01-05T00:00Z[UTC]
1998-01-10T00:00Z[UTC]
2020-01-04T00:00Z[UTC]
2020-01-06T00:00Z[UTC]
1
145
7797
1998-01-05T00:00Z[UTC]
1998-01-12T00:00Z[UTC]
2020-01-06T00:00Z[UTC]
NULL
1
145
7797
1998-01-10T00:00Z[UTC]
1998-01-12T00:00Z[UTC]
2020-01-01T00:00Z[UTC]
2020-01-06T00:00Z[UTC]
1
145
7797
1998-01-12T00:00Z[UTC]
1998-01-15T00:00Z[UTC]
2020-01-01T00:00Z[UTC]
2020-01-06T00:00Z[UTC]
1
145
7797
1998-01-15T00:00Z[UTC]
NULL
2020-01-01T00:00Z[UTC]
2020-01-02T00:00Z[UTC]
1
827
7797
1998-01-12T00:00Z[UTC]
1998-01-20T00:00Z[UTC]
2020-01-06T00:00Z[UTC]
NULL
1
827
7797
1998-01-15T00:00Z[UTC]
1998-01-20T00:00Z[UTC]
2020-01-02T00:00Z[UTC]
2020-01-06T00:00Z[UTC]
1
827
7797
1998-01-20T00:00Z[UTC]
NULL
2020-01-02T00:00Z[UTC]
2020-01-03T00:00Z[UTC]

query IIITTTT nosort
SELECT *
  FROM Prop_Owner
         FOR ALL VALID_TIME
         AS x (_id,
               customer_number,
               property_number,
               _valid_from,
               _valid_to,
               _system_from,
               _system_to)
 WHERE (x._valid_to - x._valid_from) = (TIMESTAMP '1970-01-08 00:00:00' - TIMESTAMP '1970-01-01 00:00:00')
----
1
145
7797
1998-01-05T00:00Z[UTC]
1998-01-12T00:00Z[UTC]
2020-01-06T00:00Z[UTC]
NULL

statement ok
DELETE
FROM Prop_Owner
FOR ALL VALID_TIME AS x
WHERE (x._valid_to - x._valid_from) = (TIMESTAMP '1970-01-08 00:00:00' - TIMESTAMP '1970-01-01 00:00:00')

query IIITTTT rowsort
SELECT *
  FROM Prop_Owner
         FOR ALL SYSTEM_TIME
         FOR ALL VALID_TIME
         AS x (_id,
               customer_number,
               property_number,
               _valid_from,
               _valid_to,
               _system_from,
               _system_to)
----
1
145
7797
1998-01-03T00:00Z[UTC]
1998-01-05T00:00Z[UTC]
2020-01-04T00:00Z[UTC]
2020-01-05T00:00Z[UTC]
1
145
7797
1998-01-05T00:00Z[UTC]
1998-01-10T00:00Z[UTC]
2020-01-04T00:00Z[UTC]
2020-01-06T00:00Z[UTC]
1
145
7797
1998-01-05T00:00Z[UTC]
1998-01-12T00:00Z[UTC]
2020-01-06T00:00Z[UTC]
2020-01-07T00:00Z[UTC]
1
145
7797
1998-01-10T00:00Z[UTC]
1998-01-12T00:00Z[UTC]
2020-01-01T00:00Z[UTC]
2020-01-06T00:00Z[UTC]
1
145
7797
1998-01-12T00:00Z[UTC]
1998-01-15T00:00Z[UTC]
2020-01-01T00:00Z[UTC]
2020-01-06T00:00Z[UTC]
1
145
7797
1998-01-15T00:00Z[UTC]
NULL
2020-01-01T00:00Z[UTC]
2020-01-02T00:00Z[UTC]
1
827
7797
1998-01-12T00:00Z[UTC]
1998-01-20T00:00Z[UTC]
2020-01-06T00:00Z[UTC]
NULL
1
827
7797
1998-01-15T00:00Z[UTC]
1998-01-20T00:00Z[UTC]
2020-01-02T00:00Z[UTC]
2020-01-06T00:00Z[UTC]
1
827
7797
1998-01-20T00:00Z[UTC]
NULL
2020-01-02T00:00Z[UTC]
2020-01-03T00:00Z[UTC]

query T nosort
SELECT DISTINCT x._system_from
  FROM Prop_Owner
         FOR ALL SYSTEM_TIME
         FOR ALL VALID_TIME AS x
 ORDER BY x._system_from ASC
----
2020-01-01T00:00Z[UTC]
2020-01-02T00:00Z[UTC]
2020-01-04T00:00Z[UTC]
2020-01-06T00:00Z[UTC]

query ITT nosort
SELECT *
  FROM Prop_Owner
         FOR SYSTEM_TIME AS OF TIMESTAMP '2019-01-01T00:00:00Z'
         FOR ALL VALID_TIME
         AS x (customer_number, _valid_from, _valid_to)
----


query ITT nosort
SELECT *
  FROM Prop_Owner
         FOR SYSTEM_TIME AS OF TIMESTAMP '2020-01-01T12:00:00Z'
         FOR ALL VALID_TIME
         AS x (customer_number, _valid_from, _valid_to)
----
145
1998-01-10T00:00Z[UTC]
NULL

query ITT rowsort
SELECT *
  FROM Prop_Owner
         FOR SYSTEM_TIME AS OF TIMESTAMP '2020-01-02T12:00:00Z'
         FOR ALL VALID_TIME
         AS x (customer_number, _valid_from, _valid_to)
----
145
1998-01-10T00:00Z[UTC]
1998-01-15T00:00Z[UTC]
827
1998-01-15T00:00Z[UTC]
NULL

query ITT rowsort
SELECT *
  FROM Prop_Owner
         FOR SYSTEM_TIME AS OF TIMESTAMP '2020-01-05T12:00:00Z'
         FOR ALL VALID_TIME
         AS x (customer_number, _valid_from, _valid_to)
----
145
1998-01-05T00:00Z[UTC]
1998-01-10T00:00Z[UTC]
145
1998-01-10T00:00Z[UTC]
1998-01-15T00:00Z[UTC]
827
1998-01-15T00:00Z[UTC]
1998-01-20T00:00Z[UTC]

query ITT nosort
SELECT *
  FROM Prop_Owner
         FOR ALL VALID_TIME
         AS x (customer_number, _valid_from, _valid_to)
----
827
1998-01-12T00:00Z[UTC]
1998-01-20T00:00Z[UTC]

query ITT nosort
SELECT *
  FROM Prop_Owner
         FOR ALL SYSTEM_TIME
         FOR VALID_TIME AS OF TIMESTAMP '1998-01-04Z'
         AS x (customer_number, _system_from, _system_to)
----
145
2020-01-04T00:00Z[UTC]
2020-01-05T00:00Z[UTC]

query ITT rowsort
SELECT *
  FROM Prop_Owner
         FOR ALL SYSTEM_TIME
         FOR VALID_TIME AS OF TIMESTAMP '1998-01-13Z'
         AS x (customer_number, _system_from, _system_to)
----
145
2020-01-01T00:00Z[UTC]
2020-01-06T00:00Z[UTC]
827
2020-01-06T00:00Z[UTC]
NULL

query ITT nosort
SELECT *
  FROM Prop_Owner
         FOR SYSTEM_TIME AS OF TIMESTAMP '2022-09-11 15:14:01+00:00'
         FOR VALID_TIME AS OF TIMESTAMP '1998-01-13Z'
         AS x (customer_number, _system_from, _system_to)
----
827
2020-01-06T00:00Z[UTC]
NULL

statement ok
INSERT INTO Prop_Owner (_id, customer_number, property_number, _valid_from)
VALUES (2, 827, 3621, TIMESTAMP '1998-01-15Z')
----

query IIITTTT rowsort
SELECT *
  FROM Prop_Owner
         FOR ALL SYSTEM_TIME
         FOR ALL VALID_TIME
         AS x (_id,
               customer_number,
               property_number,
               _valid_from,
               _valid_to,
               _system_from,
               _system_to)
----
1
145
7797
1998-01-03T00:00Z[UTC]
1998-01-05T00:00Z[UTC]
2020-01-04T00:00Z[UTC]
2020-01-05T00:00Z[UTC]
1
145
7797
1998-01-05T00:00Z[UTC]
1998-01-10T00:00Z[UTC]
2020-01-04T00:00Z[UTC]
2020-01-06T00:00Z[UTC]
1
145
7797
1998-01-05T00:00Z[UTC]
1998-01-12T00:00Z[UTC]
2020-01-06T00:00Z[UTC]
2020-01-07T00:00Z[UTC]
1
145
7797
1998-01-10T00:00Z[UTC]
1998-01-12T00:00Z[UTC]
2020-01-01T00:00Z[UTC]
2020-01-06T00:00Z[UTC]
1
145
7797
1998-01-12T00:00Z[UTC]
1998-01-15T00:00Z[UTC]
2020-01-01T00:00Z[UTC]
2020-01-06T00:00Z[UTC]
1
145
7797
1998-01-15T00:00Z[UTC]
NULL
2020-01-01T00:00Z[UTC]
2020-01-02T00:00Z[UTC]
1
827
7797
1998-01-12T00:00Z[UTC]
1998-01-20T00:00Z[UTC]
2020-01-06T00:00Z[UTC]
NULL
1
827
7797
1998-01-15T00:00Z[UTC]
1998-01-20T00:00Z[UTC]
2020-01-02T00:00Z[UTC]
2020-01-06T00:00Z[UTC]
1
827
7797
1998-01-20T00:00Z[UTC]
NULL
2020-01-02T00:00Z[UTC]
2020-01-03T00:00Z[UTC]
2
827
3621
1998-01-15T00:00Z[UTC]
NULL
2020-01-08T00:00Z[UTC]
NULL

query I nosort
SELECT P2.property_number
FROM Prop_Owner AS P1,
     Prop_Owner AS P2
WHERE P1.property_number = 7797
  AND P2.property_number <> P1.property_number
  AND P1.customer_number = P2.customer_number
----


query ITT nosort
SELECT P2.property_number,
       LOWER(P1._valid_time * P2._valid_time) AS VT_Begin,
       UPPER(P1._valid_time * P2._valid_time) AS VT_End
FROM Prop_Owner
FOR ALL VALID_TIME AS P1,
        Prop_Owner
FOR ALL VALID_TIME AS P2
WHERE P1.property_number = 7797
  AND P2.property_number <> P1.property_number
  AND P1.customer_number = P2.customer_number
  AND P1._VALID_TIME OVERLAPS P2._VALID_TIME
----
3621
1998-01-15T00:00Z[UTC]
1998-01-20T00:00Z[UTC]

query I nosort
SELECT P2.property_number
  FROM Prop_Owner FOR ALL VALID_TIME AS P1, Prop_Owner FOR ALL VALID_TIME AS P2
 WHERE P1.property_number = 7797
   AND P2.property_number <> P1.property_number
   AND P1.customer_number = P2.customer_number
----
3621

query ITT nosort
SELECT P2.property_number,
       LOWER(P1._system_time * P2._system_time) AS Recorded_Start,
       UPPER(P1._system_time * P2._system_time) AS Recorded_Stop
FROM Prop_Owner FOR ALL SYSTEM_TIME AS P1,
     Prop_Owner FOR ALL SYSTEM_TIME AS P2
WHERE P1.property_number = 7797
  AND P2.property_number <> P1.property_number
  AND P1.customer_number = P2.customer_number
  AND P1._SYSTEM_TIME OVERLAPS P2._SYSTEM_TIME
----


query ITTTT nosort
SELECT P2.property_number,
       LOWER(P1._valid_time * P2._valid_time) AS VT_Begin,
       UPPER(P1._valid_time * P2._valid_time) AS VT_End,
       LOWER(P1._system_time * P2._system_time) AS Recorded_Start,
       UPPER(P1._system_time * P2._system_time) AS Recorded_Stop
FROM Prop_Owner FOR ALL SYSTEM_TIME FOR ALL VALID_TIME AS P1,
     Prop_Owner FOR ALL SYSTEM_TIME FOR ALL VALID_TIME AS P2
WHERE P1.property_number = 7797
  AND P2.property_number <> P1.property_number
  AND P1.customer_number = P2.customer_number
  AND P1._VALID_TIME OVERLAPS P2._VALID_TIME
  AND P1._SYSTEM_TIME OVERLAPS P2._SYSTEM_TIME
----
3621
1998-01-15T00:00Z[UTC]
1998-01-20T00:00Z[UTC]
2020-01-08T00:00Z[UTC]
NULL

query ITT nosort
SELECT P2.property_number,
       LOWER(P1._system_time * P2._system_time) AS Recorded_Start,
       UPPER(P1._system_time * P2._system_time) AS Recorded_Stop
FROM Prop_Owner
FOR ALL SYSTEM_TIME
FOR ALL VALID_TIME AS P1,
        Prop_Owner
FOR ALL SYSTEM_TIME
FOR ALL VALID_TIME AS P2
WHERE P1.property_number = 7797
  AND P2.property_number <> P1.property_number
  AND P1.customer_number = P2.customer_number
  AND P1._SYSTEM_TIME OVERLAPS P2._SYSTEM_TIME
----
3621
2020-01-08T00:00Z[UTC]
NULL

query IT nosort
SELECT P2.property_number,
       P2._system_from AS Recorded_Start
FROM Prop_Owner
FOR ALL SYSTEM_TIME AS P1,
        Prop_Owner
FOR ALL SYSTEM_TIME AS P2
WHERE P1.property_number = 7797
  AND P2.property_number <> P1.property_number
  AND P1.customer_number = P2.customer_number
  AND P1._SYSTEM_TIME CONTAINS PERIOD(P2._system_from, P2._system_to)
----


query ITTT nosort
SELECT P2.property_number,
       LOWER(P1._valid_time * P2._valid_time) AS VT_Begin,
       UPPER(P1._valid_time * P2._valid_time) AS VT_End,
       P2._system_from AS Recorded_Start
FROM Prop_Owner FOR ALL SYSTEM_TIME FOR ALL VALID_TIME AS P1,
     Prop_Owner FOR ALL SYSTEM_TIME FOR ALL VALID_TIME AS P2
WHERE P1.property_number = 7797
  AND P2.property_number <> P1.property_number
  AND P1.customer_number = P2.customer_number
  AND P1._VALID_TIME OVERLAPS P2._VALID_TIME
  AND P1._SYSTEM_TIME CONTAINS PERIOD(P2._system_from, P2._system_to)
----
3621
1998-01-15T00:00Z[UTC]
1998-01-20T00:00Z[UTC]
2020-01-08T00:00Z[UTC]

query IT nosort
SELECT P2.property_number, P2._system_from AS Recorded_Start
  FROM Prop_Owner FOR ALL SYSTEM_TIME FOR ALL VALID_TIME AS P1,
       Prop_Owner FOR ALL SYSTEM_TIME FOR ALL VALID_TIME AS P2
 WHERE P1.property_number = 7797
   AND P2.property_number <> P1.property_number
   AND P1.customer_number = P2.customer_number
   AND P1._SYSTEM_TIME CONTAINS PERIOD(P2._system_from, P2._system_to)
----
3621
2020-01-08T00:00Z[UTC]

